ID,Name,CAS,Product_Name,Verified_On,Website_URL
ChemBook_0,"Shanghai Longyu Biotechnology Co., Ltd.", 103-63-9, (2-Bromoethyl)benzene,2019-09-05,https://www.chemicalbook.com/manufacturer/shanghai-longyu-biotechnology-164/
ChemBook_1,Siyang Liaoning Biochemical Products Co. Ltd, 103-63-9, (2-Bromoethyl)benzene,2021-04-24,https://www.chemicalbook.com/ShowSupplierProductsList1533338/0_EN.htm
ChemBook_2,"LY Global chemicals co.,ltd .", 103-63-9, (2-Bromoethyl)benzene,2023-03-06,https://www.chemicalbook.com/ShowSupplierProductsList621419/0_EN.htm
ChemBook_3,"Wuhan Boyuan Import & Export Co., LTD", 103-63-9, (2-Bromoethyl)benzene / 2-Phenylethyl bromide,,http://www.whby-chem.com/
ChemBook_4,"Jinan Finer Chemical Co., Ltd", 103-63-9, (2-Bromoethyl)benzene,2019-10-17,http://www.finerchem.com/
ChemBook_5,"Shanghai Yunao International Trade Co., Ltd", 103-63-9, (2-Bromoethyl)benzene,2023-04-21,https://www.chemicalbook.com/manufacturer/shanghai-yunao-international-trade-414/product_0_1.htm
ChemBook_6,"Hebei Guanlang Biotechnology Co,.LTD", 103-63-9, (2-Bromoethyl) Benzene,2023-12-12,https://www.chemicalbook.com/manufacturer/hebei-crovell-biotech-455/
ChemBook_7,"Wuhan wingroup Pharmaceutical Co., Ltd", 103-63-9, (2-Bromoethyl)benzene,2021-06-24,http://www.whwingroup.com/
ChemBook_8,Hebei Dangtong Import and export Co LTD, 103-63-9, (2-Bromoethyl)benzene,,https://www.chemicalbook.com/ShowSupplierProductsList609684/0_EN.htm
ChemBook_9,"Anhui Yiao New Material Technology Co., Ltd", 103-63-9, (2-Bromoethyl)benzene,2023-06-29,https://www.chemicalbook.com/manufacturer/Yiao%20New%20Material%20Technology%20-25052/
ChemBook_10,"Hebei Mojin Biotechnology Co., Ltd", 103-63-9, (2-Bromoethyl) Benzene,,https://www.mojinchemical.com/
ChemBook_11,Dorne Chemical Technology co. LTD, 103-63-9, (2-Bromoethyl)benzene,2021-04-08,https://www.chemicalbook.com/manufacturer/zibo-dorne-chemical-technology-403/
ChemBook_12,"Hubei Aumei New Material Co., Ltd.", 103-63-9, (2-Bromoethyl)benzene,2023-07-31,https://www.chemicalbook.com/ShowSupplierProductsList1022736/0_EN.htm
ChemBook_13,Wuhan Han Sheng New Material Technology Co.，Ltd, 103-63-9, 2-Phenyl-1-bromoethane,2023-04-12,https://www.hsnm.com.cn/
ChemBook_14,"Hebei Yibangte Import and Export Co. , Ltd.", 103-63-9, (2-Bromoethyl)benzene,,https://www.yibangte.com/
ChemBook_15,"Anhui Ruihan Technology Co., Ltd", 103-63-9, (2-Bromoethyl)benzene,2023-08-15,https://www.chemicalbook.com/manufacturer/anhui-ruihan-technology/
ChemBook_16,"Nantong Guangyuan Chemicl Co,Ltd", 103-63-9, (2-Bromoethyl)benzene,,https://www.chemicalbook.com/manufacturer/nantong-guangyuan-pharmaceutical-technology-25216/
ChemBook_17,"Henan Fengda Chemical Co., Ltd", 103-63-9, (2-Bromoethyl)benzene,2023-12-20,http://www.fdachem.com/
ChemBook_18,"Shandong Hanjiang Chemical Co., Ltd", 103-63-9, (2-Bromoethyl)benzene,2024-01-03,http://www.sdhanjiang.com/
ChemBook_19,Sigma Audley, 103-63-9, (2-Bromoethyl)benzene,2024-01-11,http://
ChemBook_20,"Yancheng Longshen Chemical Co.,Ltd.", 103-63-9, β-Bromoethyl-benzene,2021-08-26,http://www.longshenchem.com/index_en.html
ChemBook_21,ATK CHEMICAL COMPANY LIMITED, 103-63-9, (2-Bromoethyl)benzene,,http://www.atkchemical.com/
ChemBook_22,"Hefei TNJ Chemical Industry Co.,Ltd.", 103-63-9, (2-Bromoethyl)benzene,2019-09-25,http://www.tnjchem.com/
ChemBook_23,career henan chemical co, 103-63-9, (2-Bromoethyl)benzene,2018-07-23,https://www.coreychem.com/
ChemBook_24,"Xi'an Kono chem co., Ltd.,", 103-63-9, (2-Bromoethyl)benzene,,http://www.konochem.com/
ChemBook_25,"Chongqing Chemdad Co., Ltd", 103-63-9, (2-Bromoethyl)benzene,2019-09-10,http://www.chemdad.com/
ChemBook_26,CONIER CHEM AND PHARMA LIMITED, 103-63-9, (2-BROMOETHYL)BENZENE,,http://www.conier.com/
ChemBook_27,Shaanxi Dideu Medichem Co. Ltd, 103-63-9, (2-Bromoethyl)benzene,2019-12-23,https://www.chemicalbook.com/ShowSupplierProductsList928260/0_EN.htm
ChemBook_28,Fuxin Pharmaceutical, 103-63-9, (2-Bromoethyl)benzene,2020-03-19,http://www.fuxinpharm.com/
ChemBook_29,SIMAGCHEM CORP, 103-63-9, Β-Bromoethyl Benzene,2020-06-29,http://www.simagchem.com/
ChemBook_30,"Jinan Qinmu Fine Chemical Co.,Ltd.", 103-63-9, (2-Bromoethyl)benzene,,https://www.qinmuchem.com/
ChemBook_31,"Hubei Ipure Biology Co., Ltd", 103-63-9, (2-Bromoethyl)benzene,2020-09-18,http://www.ipurechemical.com/
ChemBook_32,Career Henan Chemica Co, 103-63-9, (2-Bromoethyl)benzene,,https://www.coreychem.com/
ChemBook_33,Shanghai UCHEM Inc., 103-63-9, (2-Bromoethyl)benzene,2023-04-17,http://www.myuchem.com/
ChemBook_34,"ANHUI WITOP BIOTECH CO., LTD", 103-63-9, (2-Bromoethyl)benzene,,https://www.chemicalbook.com/ShowSupplierProductsList418627/0_EN.htm
ChemBook_35,Shaanxi Dideu Medichem Co. Ltd, 103-63-9, (2-Bromoethyl)benzene,2021-04-12,http://www.dideu.com/
ChemBook_36,"Hebei Lingding Biotechnology Co., Ltd.", 103-63-9, (2-Bromoethyl)benzene,,https://www.hbldbiotech.com/
ChemBook_37,AFINE CHEMICALS LIMITED, 103-63-9, Β-PHENETHYL BROMIDE,2021-05-18,http://www.afinechem.com/index.html
ChemBook_38,Finetech Industry Limited, 103-63-9, (2-Bromoethyl)benzene,2021-05-27,https://www.finetechnology-ind.com/
ChemBook_39,"Baoji Guokang Bio-Technology Co., Ltd.", 103-63-9, (2-Bromoethyl)benzene,,http://www.gk-bio.com/
ChemBook_40,career henan chemical co, 1609-66-1, N-Phenyl-N-(4-piperidinyl)propanamide admixture with HCl salt,2018-07-23,https://www.coreychem.com/
ChemBook_41,"Chongqing Chemdad Co., Ltd", 1609-66-1, N-Phenyl-N-(4-piperidinyl)propanamide admixture with HCl salt,2019-09-10,http://www.chemdad.com/
ChemBook_42,CONIER CHEM AND PHARMA LIMITED, 1609-66-1, N-Phenyl-N-(4-piperidinyl)propanamide admixture with HCl salt,,http://www.conier.com/
ChemBook_43,"Hubei Ipure Biology Co., Ltd", 1609-66-1, Fentanyl EP Impurity B (USP Impurity C),2020-09-18,http://www.ipurechemical.com/
ChemBook_44,"AHH Chemical Co,.Ltd",, N-Phenyl-N-(4-piperidinyl)propanamide,,http://www.ahhchemical.com/product/MT-57232.html
ChemBook_45,"Zhongshan Follow Biotech Co.,Ltd", 1609-66-1, N-Phenyl-N-(4-piperidinyl)propanamide admixture with HCl salt,,http://www.followchem.com/
ChemBook_46,HENAN SUNLAKE ENTERPRISE CORPORATION, 1609-66-1, N-Phenyl-N-(4-piperidinyl)propanamide admixture with HCl salt,,https://www.chemicalbook.com/ShowSupplierProductsList30312/0_EN.htm
ChemBook_47,"Hangzhou Neway Chemicals Co., Ltd.", 1609-66-1, N-Phenyl-N-(4-piperidinyl)propanamide admixture with HCl salt,,http://www.nwchemical.com/
ChemBook_48,"JINHUA HUAYI CHEMICAL CO., LTD.", 1609-66-1, N-Phenyl-N-(4-piperidinyl)propanamide admixture with HCl salt,,http://www.chinahuayichem.com/
ChemBook_49,AOPHARM, 1609-66-1, N-Phenyl-N-(4-piperidinyl)propanamide admixture with HCl salt,,http://www.aopharm.com/
ChemBook_50,"Henan Allgreen Chemical Co.,Ltd", 1609-66-1, N-Phenyl-N-(4-piperidinyl)propanamide admixture with HCl salt,,http://www.allgreenchem.com/
ChemBook_51,"laidiou biological technology co.,limited", 1609-66-1, N-Phenyl-N-(4-piperidinyl)propanamide admixture with HCl salt,,https://www.chemicalbook.com/ShowSupplierProductsList30287/0_EN.htm
ChemBook_52,"Shanghai Yolne Chemical Co., Ltd.", 1609-66-1, N-Phenyl-N-(4-piperidinyl)propanamide admixture with HCl salt,,http://www.yolne.com/
ChemBook_53,"Shanghai Nuohey Chemical Co., Ltd.", 1609-66-1," N-Phenyl-N-(4-piperidinyl)propionaMide, 98%",,http://www.nuohey.com/
ChemBook_54,"Hygeia (Chengdu) pharmaceutical technique Co., Ltd", 1609-66-1, N-phenyl-N-(piperidin-4-yl)propionaMide,,http://www.hygeiapharm.com/
ChemBook_55,"Chengdu syns Pharmaceutical Co., Ltd.", 1609-66-1, N-Phenyl-N-(4-piperidinyl)propanamide admixture with HCl salt,,http://www.syns.org/
ChemBook_56,"Medsyn Biotechnology Co., Ltd", 1609-66-1, N-Phenyl-N-(4-piperidinyl)propanamide admixture with HCl salt,,http://www.medsynbio.cn/
ChemBook_57,"Henan Pumei Jihua Pharmaceutical Technology Co., Ltd.", 1609-66-1, N-phenyl-N-(piperidin-4-yl)propionamide,,http://www.pumeijihua.com/
ChemBook_58,guoyungurui, 1609-66-1, Isopolygodial(Epipolygodial),,https://www.chemicalbook.com/supplier/25521782/
ChemBook_59,"Shanghai Xiushi Biomedical Co., LTD", 1609-66-1, N-Phenyl-N-(4-piperidinyl)propanamide admixture with HCl salt,,https://www.chemicalbook.com/ShowSupplierProductsList1986421/0.htm
ChemBook_60,QUALITY CONTROL SOLUTIONS LTD., 1609-66-1, Fentanyl EP Impurity B,,https://www.qcsrm.com/
ChemBook_61,Zhengzhou anmousse chemical products co. LTD, 1609-66-1, N-Phenyl-N-4-piperidinylpropionamide,,https://www.chemicalbook.com/ShowSupplierProductsList665224/0.htm
ChemBook_62,LGC Science (Shanghai) Ltd., 1609-66-1, Fentanyl Citrate EP Impurity B; Fentanyl EP Impurity B,,https://www.lgcstandards.com/CN/en/Pharmaceutical/cat/279492
ChemBook_63,"Shanghai Hao Zhun Biological Technology Co., Ltd.", 1609-66-1, Norfentanyl,,http://www.zzsrm.com/
ChemBook_64,"ZHEJIANG JIUZHOU CHEM CO., LTD", 288573-56-8, tert-butyl 4-(4-fluoroanilino)piperidine-1-carboxylate,2022-11-24,http://www.jiuzhou-chem.com/
ChemBook_65,"Wuhan Boyuan Import & Export Co., LTD", 288573-56-8, 1-Boc-4-(4-fluoro-phenylamino)-piperidine,2023-01-11,http://www.whby-chem.com/
ChemBook_66,Siyang Liaoning Biochemical Products Co. Ltd, 288573-56-8, 1-BOC-4-(4-FLUORO-PHENYLAMINO)-PIPERIDINE,2021-04-24,https://www.chemicalbook.com/ShowSupplierProductsList1533338/0_EN.htm
ChemBook_67,"Anhui Yisheng Technology Co., LTD", 288573-56-8, tert-butyl 4-(4-fluoroanilino)piperidine-1-carboxylate,,https://www.yschemicaltech.com/
ChemBook_68,Hebei Endun Biological Technology Co. LTD, 288573-56-8, tert-butyl 4-(4-fluoroanilino)piperidine-1-carboxylate,2023-03-14,http://
ChemBook_69,"Zhengzhou Lingzhiyue Technology Co., Ltd", 288573-56-8, 1-Boc-4-(4-fluoro-phenylamino)-piperidine,2023-10-26,http://lingzhiyuechem.net/IndexEN.htm
ChemBook_70,"Shandong Huisheng Import & Export Co., Ltd.", 288573-56-8, 1-BOC-4-(4-FLUORO-PHENYLAMINO)-PIPERIDINE,,https://www.chemicalbook.com/manufacturer/shandong-huisheng-import-export-25188/
ChemBook_71,"Anhui Zhongda Biotechnology Co., Ltd", 288573-56-8, 1-BOC-4-(4-FLUORO-PHENYLAMINO)-PIPERIDINE,2023-08-02,http://
ChemBook_72,"Nantong Guangyuan Chemicl Co,Ltd", 288573-56-8, ks-0037,2023-10-12,https://www.chemicalbook.com/manufacturer/nantong-guangyuan-pharmaceutical-technology-25216/
ChemBook_73,Career Henan Chemica Co, 288573-56-8, 1-BOC-4-(4-FLUORO-PHENYLAMINO)-PIPERIDINE,2020-10-26,https://www.coreychem.com/
ChemBook_74,"Blocksynth Pharmaceutical Technology Co.,Ltd", 288573-56-8, 1-BOC-4-(4-FLUORO-PHENYLAMINO)-PIPERIDINE,,http://www.blocksynth.com/
ChemBook_75,"Zhejiang J&C Biological Technology Co.,Limited", 288573-56-8, tert-butyl 4-(4-fluoroanilino)piperidine-1-carboxylate,,https://www.sarms4muscle.com/
ChemBook_76,"Hubei Aumei New Material Co., Ltd.", 288573-56-8, tert-butyl 4-(4-fluoroanilino)piperidine-1-carboxylate,2023-07-31,https://www.chemicalbook.com/ShowSupplierProductsList1022736/0_EN.htm
ChemBook_77,"Hong Kong Excellence Biotechnology Co., Ltd.", 288573-56-8, 1-BOC-4-(4-FLUORO-PHENYLAMINO)-PIPERIDINE,2021-11-08,https://www.chemicalbook.com/ShowSupplierProductsList1274886/0_EN.htm
ChemBook_78,"Hefei TNJ Chemical Industry Co.,Ltd.", 288573-56-8," 1-Piperidinecarboxylicacid, 4-[(4-fluorophenyl)amino]-, 1,1-...",,https://www.tnjchem.com/
ChemBook_79,Shandong Believe Chemical PTE.LTD, 288573-56-8, 1-BOC-4-(4-FLUORO-PHENYLAMINO)-PIPERIDINE,2022-09-27,https://www.chemicalbook.com/ShowSupplierProductsList67294/0_EN.htm
ChemBook_80,Hebei Dangtong Import and export Co LTD, 288573-56-8, 1-BOC-4-(4-FLUORO-PHENYLAMINO)-PIPERIDINE,,https://www.chemicalbook.com/ShowSupplierProductsList609684/0_EN.htm
ChemBook_81,"Henan Aochuang Chemical Co.,Ltd.", 288573-56-8, 1-BOC-4-(4-FLUORO-PHENYLAMINO)-PIPERIDINE,2022-08-19,http://www.aochuangchem.com/
ChemBook_82,PT CHEM GROUP LIMITED, 288573-56-8, 1-BOC-4-(4-FLUORO-PHENYLAMINO)-PIPERIDINE,2022-10-31,https://www.chemicalbook.com/manufacturer/henan-lihao-chem-plant-25020/
ChemBook_83,"Anhui Yiao New Material Technology Co., Ltd", 288573-56-8, tert-butyl 4-(4-fluoroanilino)piperidine-1-carboxylate,,https://www.chemicalbook.com/manufacturer/Yiao%20New%20Material%20Technology%20-25052/
ChemBook_84,"Hebei Miaoyin Technology Co.,Ltd", 288573-56-8, 1-BOC-4-(4-FLUORO-PHENYLAMINO)-PIPERIDINE,2023-02-28,https://www.chemicalbook.com/manufacturer/hebei-miaoyin-technology-25082/
ChemBook_85,Henan Bao Enluo International TradeCo.，LTD, 288573-56-8, 1-Boc-4-(4-fluoro-phenylamino)-piperidine,2023-05-09,https://baoenluo.guidechem.com/
ChemBook_86,"Anhui Zhongda Biotechnology Co., Ltd", 288573-56-8, tert-butyl 4-(4-fluoroanilino)piperidine-1-carboxylate,,http://
ChemBook_87,"Wuhan Quanjinci New Material Co.,Ltd.", 288573-56-8, 1-BOC-4-(4-FLUORO-PHENYLAMINO)-PIPERIDINE,2023-10-10,http://www.quanjinci.com/
ChemBook_88,"Jiaxing Jlight Chemicals Co., Ltd.", 288573-56-8," 1-Piperidinecarboxylicacid, 4-[(4-fluorophenyl)amino]-, 1,1-dimethylethyl ester",,http://www.jlightchem.com/
ChemBook_89,"Zhongyifu industry Hebei co., ltd", 288573-56-8, tert-butyl 4-(4-fluoroanilino)piperidine-1-carboxylate,,https://www.zyifu.com/
ChemBook_90,"Pushan Industry (Shaanxi) Co., Ltd.", 288573-56-8, 1-BOC-4-(4-FLUORO-PHENYLAMINO)-PIPERIDINE,,https://www.pushanshiye.com/
ChemBook_91,"Beijing Haite lesk Technology Co., Ltd", 288573-56-8, 1-BOC-4-(4-FLUORO-PHENYLAMINO)-PIPERIDINE,,https://www.chemicalbook.com/ShowSupplierProductsList804170/0.htm
ChemBook_92,"Hubei Enxing Biotechnology Co., Ltd", 288573-56-8, 1-BOC-4-(4-FLUORO-PHENYLAMINO)-PIPERIDINE,,http://www.exbio-tech.com/cn/
ChemBook_93,"Hubei xingongli Chemical Co., Ltd", 288573-56-8, ert-butyl4-(4-fluoroanilino)piperidine-1-carboxylate,,http://www.xinhonglichem.com/
ChemBook_94,"Hubei Tuobang Chemical Co., Ltd.", 288573-56-8, ert-butyl4-(4-fluoroanilino)piperidine-1-carboxylate,,https://www.chemicalbook.com/ShowSupplierProductsList451023/0.htm
ChemBook_95,"Suzhou Jiayinuo Technology Co., Ltd.", 288573-56-8, tert-butyl 4-(4-fluoroanilino)piperidine-1-carboxylate,,https://www.chemicalbook.com/ShowSupplierProductsList362529/0_EN.htm
ChemBook_96,"Hubei DAHAO Chemical Co., Ltd.", 288573-56-8, ert-butyl4-(4-fluoroanilino)piperidine-1-carboxylate,,https://www.chemicalbook.com/ShowSupplierProductsList329222/0.htm
ChemBook_97,"Shenyang Maud Pharmaceutical Technology Co., Ltd.", 288573-56-8, 1-BOC-4-(4-FLUORO-PHENYLAMINO)-PIPERIDINE,,http://www.modechem.com/
ChemBook_98,"Suzhou Haihe Pharmaceutical Technology Co., Ltd.", 288573-56-8, 1-BOC-4-(4-FLUORO-PHENYLAMINO)-PIPERIDINE,,http://www.haihepharm.cn/
ChemBook_99,"Tangyuan Life Science (Shanghai) Co., Ltd", 288573-56-8, 1-BOC-4-(4-FLUORO-PHENYLAMINO)-PIPERIDINE,,http://www.townyuan.com/
ChemBook_100,"Hebei Paixing Technology Co., LTD", 288573-56-8, tert-butyl 4-(4-fluoroanilino)piperidine-1-carboxylate,,https://www.chemicalbook.com/ShowSupplierProductsList1890459/0.htm
ChemBook_101,"Shanghai Hengmao New Materials Technology CO., LIMITED", 98-86-2, Acetophenone,2022-11-01,http://shanghaihm.com/index.asp
ChemBook_102,"ZHEJIANG JIUZHOU CHEM CO., LTD", 98-86-2, Acetophenone,,http://www.jiuzhou-chem.com/
ChemBook_103,"Dalian Richfortune Chemicals Co., Ltd", 98-86-2, acetophenone,2020-01-10,http://www.richfortunechem.com/
ChemBook_104,"Wuhan Boyuan Import & Export Co., LTD", 98-86-2, Acetophenone,,http://www.whby-chem.com/
ChemBook_105,"Hebei Guanlang Biotechnology Co., Ltd.", 98-86-2, Acetophenone,2023-11-06,https://www.chemicalbook.com/manufacturer/crovell/
ChemBook_106,"Hebei Guanlang Biotechnology Co,.LTD", 98-86-2, Acetophenone,2023-12-12,https://www.chemicalbook.com/manufacturer/hebei-crovell-biotech-455/
ChemBook_107,"Hebei Mojin Biotechnology Co., Ltd", 98-86-2, Acetophenone,2020-06-19,https://www.mojinchemical.com/
ChemBook_108,"China Synchem Technology Co.,Ltd.", 98-86-2, Acetophenone,,http://www.cnsynchem.com/
ChemBook_109,"Hebei Fengqiang Trading Co., LTD", 98-86-2, Acetophenone,2023-05-26,https://www.chemicalbook.com/manufacturer/hbfengqiang%20trading%20company/
ChemBook_110,Hubeicowardchemical, 98-86-2, acetophenone,,http://www.cowardchemical.com/
ChemBook_111,"Capot Chemical Co.,Ltd.", 98-86-2, Acetophenone,2017-10-19,http://www.capotchem.com/
ChemBook_112,"Hangzhou FandaChem Co.,Ltd.", 98-86-2, Acetophenone,,http://www.fandachem.com/
ChemBook_113,"Hefei TNJ Chemical Industry Co.,Ltd.", 98-86-2, Acetophenone,2019-09-25,http://www.tnjchem.com/
ChemBook_114,career henan chemical co, 98-86-2, Acetophenone,2018-07-23,https://www.coreychem.com/
ChemBook_115,Zhejiang ZETian Fine Chemicals Co. LTD, 98-86-2, Acetophenone,,http://www.zetchem.com/
ChemBook_116,SHANDONG ZHI SHANG CHEMICAL CO.LTD, 98-86-2, Acetophenone,2021-03-20,https://www.zhishangchem.com/
ChemBook_117,"Shanghai Worldyang Chemical Co.,Ltd.", 98-86-2, acetophenone,,https://www.chemicalbook.com/manufacturer/shanghai-worldyang-chemical-203/
ChemBook_118,"Xiamen AmoyChem Co., Ltd", 98-86-2, Acetophenone,2019-05-09,http://www.amoychem.com/
ChemBook_119,"Changzhou Ditong Chemical Co.,Ltd", 98-86-2, Acetophenone,,http://www.edengenechem.com/
ChemBook_120,"Chongqing Chemdad Co., Ltd", 98-86-2, Acetophenone,2019-09-10,http://www.chemdad.com/
ChemBook_121,CONIER CHEM AND PHARMA LIMITED, 98-86-2, Acetophenone,2019-12-07,http://www.conier.com/
ChemBook_122,Shaanxi Dideu Medichem Co. Ltd, 98-86-2, Acetophenone,,https://www.chemicalbook.com/manufacturer/shaanxi-dideu-medichem-221/
ChemBook_123,Fuxin Pharmaceutical, 98-86-2, Acetophenone,2020-03-19,http://www.fuxinpharm.com/
ChemBook_124,"Neostar United (Changzhou) Industrial Co., Ltd.", 98-86-2, Acetophenone,,http://www.neostarunited.com/
ChemBook_125,SIMAGCHEM CORP, 98-86-2, Acetophenone,2020-06-29,http://www.simagchem.com/
ChemBook_126,"Kindchem(Nanjing)Co.,Ltd", 98-86-2, Acetophenone,,http://www.kindchem.cn/
ChemBook_127,"Hefei TNJ Chemical Industry Co.,Ltd.", 98-86-2, Acetophenone,2020-11-09,https://www.tnjchem.com/
ChemBook_128,"WinWin Chemical CO., Limited", 98-86-2, Acetophenone,2020-12-23,https://www.win-winchemical.com/
ChemBook_129,Shanghai UCHEM Inc., 98-86-2, Acetophenone,2023-04-17,http://www.myuchem.com/
ChemBook_130,"ANHUI WITOP BIOTECH CO., LTD", 98-86-2, Acetophenone,,https://www.chemicalbook.com/ShowSupplierProductsList418627/0_EN.htm
ChemBook_131,AFINE CHEMICALS LIMITED, 98-86-2, ACETOPHENONE,2021-05-18,http://www.afinechem.com/index.html
ChemBook_132,"Baoji Guokang Bio-Technology Co., Ltd.", 98-86-2, Acetophenone,,http://www.gk-bio.com/
ChemBook_133,"Dayang Chem (Hangzhou) Co.,Ltd.", 98-86-2, Acetylbenzene,2021-07-08,https://www.dycnchem.com/
ChemBook_134,"Hubei Aumei New Material Co., Ltd.", 98-86-2, Acetophenone,,https://www.chemicalbook.com/ShowSupplierProductsList1022736/0_EN.htm
ChemBook_135,"Zhuoer Chemical Co., Ltd", 98-86-2, Acetophenone,2021-07-20,http://www.zhuoerchem.com/
ChemBook_136,CD Chemical Group Limited, 98-86-2, Acetophenone,,http://www.codchem.com/
ChemBook_137,"Henan Alfa Chemical Co., Ltd", 98-86-2, Acetophenone,2021-10-21,https://www.chemicalbook.com/manufacturer/henan-alfa-chemical-570/
ChemBook_138,"changzhou huayang technology co., ltd", 98-86-2, Acetophenone,,http://www.huayangchem.com/template/eabout.html
ChemBook_139,"ShanDong Look Chemical Co.,Ltd.", 98-86-2, Acetophenone,2021-12-01,https://www.sdlookchem.com/
ChemBook_140,"Shandong Zhishang New Material Co., Ltd.", 98-86-2, Acetophenone,,https://www.zhishangchemical.com/
